master,url
Máster Universitario en Gestión Estratégica y Negocios Internacionales, https://www.us.es/estudiar/que-estudiar/oferta-de-masteres/master-universitario-en-gestion-estrategica-y-negocios
Máster Universitario en Dirección y Planificación del Turismo, https://www.us.es/estudiar/que-estudiar/oferta-de-masteres/master-universitario-en-direccion-y-planificacion-del
Doble Máster Universitario en Ciencias del Trabajo y en Gestión y Desarrollo de los Recursos Humanos, https://www.us.es/estudiar/que-estudiar/oferta-de-masteres/doble-master-universitario-en-ciencias-del-trabajo-y-en
Máster Universitario en Ciencias del Trabajo, https://www.us.es/estudiar/que-estudiar/oferta-de-masteres/master-universitario-en-ciencias-del-trabajo
Máster Universitario en Gestión y Desarrollo de Recursos Humanos, https://www.us.es/estudiar/que-estudiar/oferta-de-masteres/master-universitario-en-gestion-y-desarrollo-de-recursos
Máster Universitario en Dirección Financiera, https://www.us.es/estudiar/que-estudiar/oferta-de-masteres/master-universitario-en-direccion-financiera
Máster Universitario en Comunicación Institucional y Política, https://www.us.es/estudiar/que-estudiar/oferta-de-masteres/master-universitario-en-comunicacion-institucional-y
Máster Universitario en Guión - Narrativa y Creatividad Audiovisual (2019), https://www.us.es/estudiar/que-estudiar/oferta-de-masteres/master-universitario-en-guion-narrativa-y-creatividad
Máster Universitario en Estudios de Género y Desarrollo Profesional, https://www.us.es/estudiar/que-estudiar/oferta-de-masteres/master-universitario-en-estudios-de-genero-y-desarrollo
Master Universitario en Profesorado de Enseñanza Secundaria Obligatoria y Bachillerato - Formación Profesional y Enseñanza de Idiomas, https://www.us.es/estudiar/que-estudiar/oferta-de-masteres/master-universitario-en-profesorado-de-ensenanza
Máster Universitario en Gestión Integral de la Edificación, https://www.us.es/estudiar/que-estudiar/oferta-de-masteres/master-universitario-en-gestion-integral-de-la-edificacion
Máster Universitario en Especialización Profesional en Farmacia, https://www.us.es/estudiar/que-estudiar/oferta-de-masteres/master-universitario-en-especializacion-profesional-en
Máster Universitario en Sistemas Inteligentes en Energía y Transporte por la Universidad de Sevilla y la Universidad de Málaga, https://www.us.es/estudiar/que-estudiar/oferta-de-masteres/master-universitario-en-sistemas-inteligentes-en-energia-y
Máster Universitario en Ingeniería del Software - Cloud - Datos y Gestión de las Tecnologías de la Información, https://www.us.es/estudiar/que-estudiar/oferta-de-masteres/master-universitario-en-ingenieria-del-software-cloud
Máster Universitario en Logística y Gestión de Operaciones (UNIA-UCA-US), https://www.us.es/estudiar/que-estudiar/oferta-de-masteres/master-universitario-en-logistica-y-gestion-de-operaciones
